{
  "metadata": {
    "run_id": "synthetic-run",
    "generated_date": "2026-07-14T00:00:00Z",
    "agent": "01-attribution-modeling",
    "total_deals_processed": 35,
    "deals_skipped": {
      "count": 0,
      "deal_ids": []
    },
    "total_pipeline_attributed": 4464023.8,
    "models_computed": [
      "first_touch",
      "last_touch",
      "linear",
      "time_decay",
      "w_shaped"
    ],
    "half_life_days": 7,
    "channel_activity": {
      "Content Marketing": {
        "first_touchpoint_date": "2025-07-04",
        "last_touchpoint_date": "2026-06-30",
        "total_touchpoint_count": 59
      },
      "LinkedIn": {
        "first_touchpoint_date": "2025-07-11",
        "last_touchpoint_date": "2026-06-30",
        "total_touchpoint_count": 26
      },
      "Email Campaigns": {
        "first_touchpoint_date": "2025-07-19",
        "last_touchpoint_date": "2026-06-19",
        "total_touchpoint_count": 36
      },
      "Google Ads": {
        "first_touchpoint_date": "2025-07-26",
        "last_touchpoint_date": "2026-05-27",
        "total_touchpoint_count": 53
      },
      "Outbound BDR": {
        "first_touchpoint_date": "2025-07-25",
        "last_touchpoint_date": "2026-04-13",
        "total_touchpoint_count": 22
      },
      "Events": {
        "first_touchpoint_date": "2025-09-01",
        "last_touchpoint_date": "2026-03-21",
        "total_touchpoint_count": 16
      }
    }
  },
  "channel_summary": {
    "Content Marketing": {
      "first_touch": {
        "pipeline_credited": 1210444.75,
        "rank": 2,
        "deals_touched": 23,
        "touchpoint_count": 59,
        "avg_credit_per_deal": 52628.03,
        "pct_of_total": 27.1
      },
      "last_touch": {
        "pipeline_credited": 1232736.05,
        "rank": 1,
        "deals_touched": 23,
        "touchpoint_count": 59,
        "avg_credit_per_deal": 53597.22,
        "pct_of_total": 27.6
      },
      "linear": {
        "pipeline_credited": 1146718.7,
        "rank": 1,
        "deals_touched": 23,
        "touchpoint_count": 59,
        "avg_credit_per_deal": 49857.33,
        "pct_of_total": 25.7
      },
      "time_decay": {
        "pipeline_credited": 1492538.61,
        "rank": 1,
        "deals_touched": 23,
        "touchpoint_count": 59,
        "avg_credit_per_deal": 64892.98,
        "pct_of_total": 33.4
      },
      "w_shaped": {
        "pipeline_credited": 1202339.48,
        "rank": 2,
        "deals_touched": 23,
        "touchpoint_count": 59,
        "avg_credit_per_deal": 52275.63,
        "pct_of_total": 26.9
      }
    },
    "Email Campaigns": {
      "first_touch": {
        "pipeline_credited": 144979.9,
        "rank": 5,
        "deals_touched": 19,
        "touchpoint_count": 36,
        "avg_credit_per_deal": 7630.52,
        "pct_of_total": 3.2
      },
      "last_touch": {
        "pipeline_credited": 862863.89,
        "rank": 2,
        "deals_touched": 19,
        "touchpoint_count": 36,
        "avg_credit_per_deal": 45413.89,
        "pct_of_total": 19.3
      },
      "linear": {
        "pipeline_credited": 790309.43,
        "rank": 3,
        "deals_touched": 19,
        "touchpoint_count": 36,
        "avg_credit_per_deal": 41595.23,
        "pct_of_total": 17.7
      },
      "time_decay": {
        "pipeline_credited": 1327877.07,
        "rank": 2,
        "deals_touched": 19,
        "touchpoint_count": 36,
        "avg_credit_per_deal": 69888.27,
        "pct_of_total": 29.7
      },
      "w_shaped": {
        "pipeline_credited": 440766.88,
        "rank": 4,
        "deals_touched": 19,
        "touchpoint_count": 36,
        "avg_credit_per_deal": 23198.26,
        "pct_of_total": 9.9
      }
    },
    "Events": {
      "first_touch": {
        "pipeline_credited": 22628.68,
        "rank": 6,
        "deals_touched": 6,
        "touchpoint_count": 16,
        "avg_credit_per_deal": 3771.45,
        "pct_of_total": 0.5
      },
      "last_touch": {
        "pipeline_credited": 536048.91,
        "rank": 5,
        "deals_touched": 6,
        "touchpoint_count": 16,
        "avg_credit_per_deal": 89341.49,
        "pct_of_total": 12.0
      },
      "linear": {
        "pipeline_credited": 311645.15,
        "rank": 6,
        "deals_touched": 6,
        "touchpoint_count": 16,
        "avg_credit_per_deal": 51940.86,
        "pct_of_total": 7.0
      },
      "time_decay": {
        "pipeline_credited": 557763.72,
        "rank": 3,
        "deals_touched": 6,
        "touchpoint_count": 16,
        "avg_credit_per_deal": 92960.62,
        "pct_of_total": 12.5
      },
      "w_shaped": {
        "pipeline_credited": 206615.34,
        "rank": 6,
        "deals_touched": 6,
        "touchpoint_count": 16,
        "avg_credit_per_deal": 34435.89,
        "pct_of_total": 4.6
      }
    },
    "Google Ads": {
      "first_touch": {
        "pipeline_credited": 1868819.94,
        "rank": 1,
        "deals_touched": 24,
        "touchpoint_count": 53,
        "avg_credit_per_deal": 77867.5,
        "pct_of_total": 41.9
      },
      "last_touch": {
        "pipeline_credited": 612262.4,
        "rank": 4,
        "deals_touched": 24,
        "touchpoint_count": 53,
        "avg_credit_per_deal": 25510.93,
        "pct_of_total": 13.7
      },
      "linear": {
        "pipeline_credited": 1044229.73,
        "rank": 2,
        "deals_touched": 24,
        "touchpoint_count": 53,
        "avg_credit_per_deal": 43509.57,
        "pct_of_total": 23.4
      },
      "time_decay": {
        "pipeline_credited": 537607.74,
        "rank": 4,
        "deals_touched": 24,
        "touchpoint_count": 53,
        "avg_credit_per_deal": 22400.32,
        "pct_of_total": 12.0
      },
      "w_shaped": {
        "pipeline_credited": 1405247.82,
        "rank": 1,
        "deals_touched": 24,
        "touchpoint_count": 53,
        "avg_credit_per_deal": 58551.99,
        "pct_of_total": 31.5
      }
    },
    "LinkedIn": {
      "first_touch": {
        "pipeline_credited": 375601.22,
        "rank": 4,
        "deals_touched": 15,
        "touchpoint_count": 26,
        "avg_credit_per_deal": 25040.08,
        "pct_of_total": 8.4
      },
      "last_touch": {
        "pipeline_credited": 426751.37,
        "rank": 6,
        "deals_touched": 15,
        "touchpoint_count": 26,
        "avg_credit_per_deal": 28450.09,
        "pct_of_total": 9.6
      },
      "linear": {
        "pipeline_credited": 616755.04,
        "rank": 4,
        "deals_touched": 15,
        "touchpoint_count": 26,
        "avg_credit_per_deal": 41117.0,
        "pct_of_total": 13.8
      },
      "time_decay": {
        "pipeline_credited": 272148.23,
        "rank": 6,
        "deals_touched": 15,
        "touchpoint_count": 26,
        "avg_credit_per_deal": 18143.22,
        "pct_of_total": 6.1
      },
      "w_shaped": {
        "pipeline_credited": 424572.07,
        "rank": 5,
        "deals_touched": 15,
        "touchpoint_count": 26,
        "avg_credit_per_deal": 28304.8,
        "pct_of_total": 9.5
      }
    },
    "Outbound BDR": {
      "first_touch": {
        "pipeline_credited": 841549.31,
        "rank": 3,
        "deals_touched": 15,
        "touchpoint_count": 22,
        "avg_credit_per_deal": 56103.29,
        "pct_of_total": 18.9
      },
      "last_touch": {
        "pipeline_credited": 793361.18,
        "rank": 3,
        "deals_touched": 15,
        "touchpoint_count": 22,
        "avg_credit_per_deal": 52890.75,
        "pct_of_total": 17.8
      },
      "linear": {
        "pipeline_credited": 554365.75,
        "rank": 5,
        "deals_touched": 15,
        "touchpoint_count": 22,
        "avg_credit_per_deal": 36957.72,
        "pct_of_total": 12.4
      },
      "time_decay": {
        "pipeline_credited": 276088.43,
        "rank": 5,
        "deals_touched": 15,
        "touchpoint_count": 22,
        "avg_credit_per_deal": 18405.9,
        "pct_of_total": 6.2
      },
      "w_shaped": {
        "pipeline_credited": 784482.21,
        "rank": 3,
        "deals_touched": 15,
        "touchpoint_count": 22,
        "avg_credit_per_deal": 52298.81,
        "pct_of_total": 17.6
      }
    }
  },
  "campaign_detail": {
    "Content Marketing": {
      "Blog/SEO": {
        "first_touch": {
          "pipeline_credited": 200113.5,
          "rank": 2,
          "deals_touched": 12,
          "touchpoint_count": 19,
          "avg_credit_per_deal": 16676.12,
          "pct_of_total": 4.5
        },
        "last_touch": {
          "pipeline_credited": 227335.66,
          "rank": 3,
          "deals_touched": 12,
          "touchpoint_count": 19,
          "avg_credit_per_deal": 18944.64,
          "pct_of_total": 5.1
        },
        "linear": {
          "pipeline_credited": 366111.35,
          "rank": 2,
          "deals_touched": 12,
          "touchpoint_count": 19,
          "avg_credit_per_deal": 30509.28,
          "pct_of_total": 8.2
        },
        "time_decay": {
          "pipeline_credited": 473978.83,
          "rank": 3,
          "deals_touched": 12,
          "touchpoint_count": 19,
          "avg_credit_per_deal": 39498.24,
          "pct_of_total": 10.6
        },
        "w_shaped": {
          "pipeline_credited": 228808.78,
          "rank": 2,
          "deals_touched": 12,
          "touchpoint_count": 19,
          "avg_credit_per_deal": 19067.4,
          "pct_of_total": 5.1
        }
      },
      "Ebooks/Guides": {
        "first_touch": {
          "pipeline_credited": 905140.0,
          "rank": 1,
          "deals_touched": 13,
          "touchpoint_count": 21,
          "avg_credit_per_deal": 69626.15,
          "pct_of_total": 20.3
        },
        "last_touch": {
          "pipeline_credited": 570918.65,
          "rank": 1,
          "deals_touched": 13,
          "touchpoint_count": 21,
          "avg_credit_per_deal": 43916.82,
          "pct_of_total": 12.8
        },
        "linear": {